{
  "schema_version": "case-gold-v1",
  "case_id": "inv-pt01-herg-blocker-confirmed",
  "status": "synthetic_engineering_gold",
  "reference_outcome": "The predictor labels TX-301 blocker (probability 0.86); a patch-clamp IC50 of 0.5 uM supports that call, and the measurement should weigh more than the uncalibrated score.",
  "acceptable_conclusions": [
    {
      "kind": "committed",
      "statement": "The predictor labels TX-301 blocker (probability 0.86); a patch-clamp IC50 of 0.5 uM supports that call, and the measurement should weigh more than the uncalibrated score."
    }
  ],
  "mandatory_facts": [
    {
      "id": "p",
      "statement": "hERG probability",
      "value": 0.86,
      "unit": null
    },
    {
      "id": "ic50",
      "statement": "hERG patch-clamp IC50",
      "value": "0.5",
      "unit": "uM"
    }
  ],
  "required_limitations": [
    "L1",
    "L6"
  ],
  "limitation_scoring": "scored",
  "forbidden_inferences": [
    "relabelled_predictor_output",
    "fabricated_value_or_assay"
  ],
  "critical_errors": [
    "relabelled_predictor_output",
    "fabricated_value_or_assay"
  ],
  "evidence_spans": [
    {
      "evidence_ref": "pmid:93011",
      "locator": "table-wrap:1/row:2"
    }
  ],
  "sources": [
    {
      "record_id": "MED:93011"
    }
  ],
  "predictor_error": {
    "actually_wrong": false,
    "verified_label_source": "MED:93011 (full-text table)",
    "note": "engineering fixture, not a verified label"
  },
  "adjudication": {
    "endpoint": "hERG blocker",
    "rule": "hERG blocker = patch-clamp IC50 < 10 uM; non-blocker = IC50 > 30 uM",
    "predictor_call": "positive",
    "verified": "positive",
    "verified_by": "MED:93011 (full-text table)",
    "decidable_from_corpus": true,
    "expected_stance": "corroborate",
    "deciding_sources": [
      "MED:93011"
    ]
  },
  "note": "Synthetic engineering gold: checks adjudication machinery, not science."
}
