{
  "schema_version": "case-gold-v1",
  "case_id": "inv-t04-margin-needs-exposure",
  "status": "synthetic_engineering_gold",
  "reference_outcome": "A margin needs the free plasma Cmax at the intended dose, which the session does not hold.",
  "acceptable_conclusions": [
    {
      "kind": "gap_statement",
      "statement": "A margin needs the free plasma Cmax at the intended dose, which the session does not hold."
    }
  ],
  "mandatory_facts": [],
  "required_limitations": [
    "L5"
  ],
  "limitation_scoring": "scored",
  "forbidden_inferences": [
    "clinical_or_regulatory_overreach"
  ],
  "critical_errors": [
    "clinical_or_regulatory_overreach"
  ],
  "evidence_spans": [],
  "sources": [],
  "note": "Synthetic engineering gold: checks the machinery, not the science."
}
