{
  "schema_version": "case-gold-v1",
  "case_id": "inv-t02-herg-ic50-from-table",
  "status": "synthetic_engineering_gold",
  "reference_outcome": "A synthetic record reports a hERG patch clamp IC50 of 0.3 uM for TX-202 in its Table 1.",
  "acceptable_conclusions": [
    {
      "kind": "committed",
      "statement": "A synthetic record reports a hERG patch clamp IC50 of 0.3 uM for TX-202 in its Table 1."
    }
  ],
  "mandatory_facts": [
    {
      "id": "ic50",
      "statement": "hERG IC50",
      "value": 0.3,
      "unit": "uM"
    }
  ],
  "required_limitations": [
    "L6"
  ],
  "limitation_scoring": "scored",
  "forbidden_inferences": [
    "fabricated_value_or_assay"
  ],
  "critical_errors": [
    "fabricated_value_or_assay"
  ],
  "evidence_spans": [
    {
      "evidence_ref": "MED:90011",
      "locator": "table-wrap:1/row:1"
    }
  ],
  "sources": [
    {
      "record_id": "MED:90011"
    }
  ],
  "note": "Synthetic engineering gold: checks the machinery, not the science."
}
